{
  "username": "concert_fan",
  "artist": "Led Zeppelin",
  "track": "Stairway to Heaven - Live at Madison Square Garden",
  "normalized_title": "Stairway to Heaven",
  "album": "The Song Remains the Same",
  "uts": 1704560400,
  "local_time": "2025-01-06T15:30:00Z",
  "mbid": null,
  "source": "lastfm",
  "ingested_at": "2025-01-07T10:05:00Z",
  "raw": {
    "artist": {
      "mbid": "678910",
      "#text": "Led Zeppelin"
    },
    "name": "Stairway to Heaven - Live at Madison Square Garden",
    "album": {
      "mbid": "",
      "#text": "The Song Remains the Same"
    },
    "date": {
      "uts": "1704560400"
    }
  }
}
